{
  "id": "php-8.2",
  "display_name": "PHP 8.2",
  "category": "php",
  "description": "PHP 8.2 FPM runtime for sites",
  "managed": true,
  "system": false,
  "installable": true,
  "min_os": {
    "ubuntu": "24.04",
    "debian": "12",
    "el": "9"
  },
  "ports": [],
  "conflicts": [],
  "distros": {
    "ubuntu": {
      "packages": [
        "php8.2-fpm",
        "php8.2-cli"
      ],
      "unit_name": "php8.2-fpm",
      "detect": {
        "packages": [
          "php8.2-fpm"
        ],
        "unit": "php8.2-fpm",
        "command": "php8.2 -v"
      },
      "paths": {
        "php_ini": [
          "/etc/php/8.2/fpm/php.ini"
        ],
        "fpm_socket": [
          "/run/php/php8.2-fpm.sock"
        ],
        "fpm_pool_globs": [
          "/etc/php/8.2/fpm/pool.d/*.conf"
        ]
      }
    },
    "debian": {
      "packages": [
        "php8.2-fpm",
        "php8.2-cli"
      ],
      "unit_name": "php8.2-fpm",
      "detect": {
        "packages": [
          "php8.2-fpm"
        ],
        "unit": "php8.2-fpm",
        "command": "php8.2 -v"
      },
      "paths": {
        "php_ini": [
          "/etc/php/8.2/fpm/php.ini"
        ],
        "fpm_socket": [
          "/run/php/php8.2-fpm.sock"
        ],
        "fpm_pool_globs": [
          "/etc/php/8.2/fpm/pool.d/*.conf"
        ]
      }
    },
    "el": {
      "packages": [
        "php82-php-fpm",
        "php82-php-cli"
      ],
      "unit_name": "php82-php-fpm",
      "detect": {
        "packages": [
          "php82-php-fpm"
        ],
        "unit": "php82-php-fpm",
        "command": "php82 -v"
      },
      "paths": {
        "php_ini": [
          "/etc/opt/remi/php82/php.ini"
        ],
        "fpm_socket": [
          "/var/opt/remi/php82/run/php-fpm/www.sock",
          "/run/php-fpm/www.sock"
        ],
        "fpm_pool_globs": [
          "/etc/opt/remi/php82/php-fpm.d/*.conf"
        ]
      }
    }
  },
  "preflight": {
    "min_disk_gb": 0.5,
    "min_ram_mb": 256
  }
}
