{
  "id": "php-8.4",
  "display_name": "PHP 8.4 (panel runtime)",
  "category": "runtime",
  "description": "Pinned panel PHP-FPM pool; non-removable while panel runs.",
  "managed": true,
  "system": true,
  "min_os": {
    "ubuntu": "24.04",
    "debian": "12",
    "el": "9"
  },
  "ports": [],
  "conflicts": [],
  "distros": {
    "debian": {
      "packages": [
        "php8.4-fpm",
        "php8.4-cli",
        "php8.4-common",
        "php8.4-sqlite3",
        "php8.4-mbstring",
        "php8.4-xml",
        "php8.4-curl",
        "php8.4-zip"
      ],
      "unit_name": "php8.4-fpm",
      "detect": {
        "packages": [
          "php8.4-fpm"
        ],
        "unit": "php8.4-fpm",
        "command": "php8.4 -v"
      },
      "repo": {
        "url": "https://packages.sury.org/php/",
        "gpg_fingerprint": "B188E2B6957258CB978A068AC3E4FAA2224E5DC7",
        "keyring": "/usr/share/keyrings/deb.sury.org-php.gpg",
        "signed_by": "/usr/share/keyrings/deb.sury.org-php.gpg"
      },
      "paths": {
        "php_ini": [
          "/etc/php/8.4/fpm/php.ini"
        ],
        "fpm_socket": [
          "/run/php/php8.4-fpm.sock"
        ],
        "fpm_pool_globs": [
          "/etc/php/8.4/fpm/pool.d/*.conf"
        ]
      }
    },
    "ubuntu": {
      "packages": [
        "php8.4-fpm",
        "php8.4-cli",
        "php8.4-common",
        "php8.4-sqlite3",
        "php8.4-mbstring",
        "php8.4-xml",
        "php8.4-curl",
        "php8.4-zip"
      ],
      "unit_name": "php8.4-fpm",
      "detect": {
        "packages": [
          "php8.4-fpm"
        ],
        "unit": "php8.4-fpm",
        "command": "php8.4 -v"
      },
      "repo": {
        "url": "https://packages.sury.org/php/",
        "gpg_fingerprint": "B188E2B6957258CB978A068AC3E4FAA2224E5DC7",
        "keyring": "/usr/share/keyrings/deb.sury.org-php.gpg",
        "signed_by": "/usr/share/keyrings/deb.sury.org-php.gpg"
      },
      "paths": {
        "php_ini": [
          "/etc/php/8.4/fpm/php.ini"
        ],
        "fpm_socket": [
          "/run/php/php8.4-fpm.sock"
        ],
        "fpm_pool_globs": [
          "/etc/php/8.4/fpm/pool.d/*.conf"
        ]
      }
    },
    "el": {
      "packages": [
        "php-fpm",
        "php-cli",
        "php-common",
        "php-mysqlnd",
        "php-pdo",
        "php-xml",
        "php-mbstring",
        "php-zip",
        "php-sodium"
      ],
      "unit_name": "php-fpm",
      "detect": {
        "packages": [
          "php-fpm"
        ],
        "unit": "php-fpm",
        "command": "php -v"
      },
      "repo": {
        "url": "https://rpms.remirepo.net/enterprise/remi-release-9.rpm",
        "gpg_fingerprint": "",
        "keyring": "/etc/pki/rpm-gpg/RPM-GPG-KEY-remi",
        "signed_by": ""
      },
      "paths": {
        "php_ini": [
          "/etc/php.ini",
          "/etc/opt/remi/php84/php.ini"
        ],
        "fpm_socket": [
          "/run/php-fpm/www.sock",
          "/var/opt/remi/php84/run/php-fpm/www.sock"
        ],
        "fpm_pool_globs": [
          "/etc/php-fpm.d/*.conf",
          "/etc/opt/remi/php84/php-fpm.d/*.conf"
        ]
      }
    }
  },
  "preflight": {
    "min_disk_gb": 0.5,
    "min_ram_mb": 256
  }
}
