{
  "id": "postgresql",
  "display_name": "PostgreSQL",
  "category": "database",
  "description": "PostgreSQL relational database server",
  "managed": true,
  "system": false,
  "installable": true,
  "min_os": {
    "ubuntu": "24.04",
    "debian": "12",
    "el": "9"
  },
  "ports": [
    {
      "port": 5432,
      "bind": "127.0.0.1",
      "owner": "postgres",
      "protocol": "tcp"
    }
  ],
  "conflicts": [],
  "distros": {
    "ubuntu": {
      "packages": [
        "postgresql"
      ],
      "unit_name": "postgresql",
      "detect": {
        "packages": [
          "postgresql"
        ],
        "package_regex": "^postgresql-[0-9]+$",
        "unit": "postgresql"
      },
      "paths": {
        "conf_globs": [
          "/etc/postgresql/*/main/postgresql.conf"
        ],
        "hba_globs": [
          "/etc/postgresql/*/main/pg_hba.conf"
        ]
      }
    },
    "debian": {
      "packages": [
        "postgresql"
      ],
      "unit_name": "postgresql",
      "detect": {
        "packages": [
          "postgresql"
        ],
        "package_regex": "^postgresql-[0-9]+$",
        "unit": "postgresql"
      },
      "paths": {
        "conf_globs": [
          "/etc/postgresql/*/main/postgresql.conf"
        ],
        "hba_globs": [
          "/etc/postgresql/*/main/pg_hba.conf"
        ]
      }
    },
    "el": {
      "packages": [
        "postgresql-server"
      ],
      "unit_name": "postgresql",
      "detect": {
        "packages": [
          "postgresql-server"
        ],
        "unit": "postgresql",
        "command": "psql --version"
      },
      "post_install": [
        "test -f /var/lib/pgsql/data/PG_VERSION || postgresql-setup --initdb"
      ],
      "paths": {
        "conf_globs": [
          "/var/lib/pgsql/*/data/postgresql.conf",
          "/var/lib/pgsql/data/postgresql.conf"
        ],
        "hba_globs": [
          "/var/lib/pgsql/*/data/pg_hba.conf",
          "/var/lib/pgsql/data/pg_hba.conf"
        ]
      }
    }
  },
  "preflight": {
    "min_disk_gb": 2,
    "min_ram_mb": 1024
  }
}
